id,question
159,What is the name of the exercise that targets the upper body using a Smith machine?
159,Which muscle groups are primarily activated during the Smith Machine Row?
159,Can you describe the proper stance for performing the Smith Machine Row?
159,What type of exercise is the Smith Machine Row classified as?
159,What movement pattern does the Smith Machine Row utilize?
160,What is the primary muscle group targeted by the Lat Pullover exercise?
160,What equipment do I need to perform the Lat Pullover?
160,Can you describe the starting position for the Lat Pullover?
160,What are the steps involved in performing a Lat Pullover?
160,Which part of the body does the Lat Pullover primarily work?
161,What muscles are primarily activated during the Smith Machine Shoulder Press?
161,How should I position myself on the bench when performing this exercise?
161,What is the correct movement pattern for the Smith Machine Shoulder Press?
161,Which type of equipment is required for this exercise?
161,Is the Smith Machine Shoulder Press focused on a push or pull movement?
162,What is the Cable Woodchopper exercise designed to strengthen?
162,Which muscle groups are activated during the Cable Woodchopper?
162,How do you properly perform the Cable Woodchopper?
162,What type of equipment do I need for the Cable Woodchopper?
162,In which direction should I stand relative to the cable machine for the Cable Woodchopper?
163,What is the primary body part targeted by the Machine Back Extension exercise?
163,Which muscle groups are activated during the Machine Back Extension?
163,How should I position my feet while using the back extension machine?
163,Can you describe the movement pattern involved in the Machine Back Extension?
163,Is the Machine Back Extension primarily a strength or cardio exercise?
164,What is the primary muscle group activated by the Prone Leg Curl exercise?
164,How do I perform the Prone Leg Curl correctly?
164,What position should I be in when using the leg curl machine?
164,Is the Prone Leg Curl considered a strength training exercise?
164,Which body part does the Prone Leg Curl target?
165,What is the Seated Dumbbell Press targeting in terms of muscle groups?
165,How should I position my dumbbells when starting the Seated Dumbbell Press?
165,What is the correct movement for the Seated Dumbbell Press?
165,Which part of the body does the Seated Dumbbell Press primarily work out?
165,Is the Seated Dumbbell Press considered a push or pull exercise?
166,What is the proper starting position for the Weighted Plank exercise?
166,Which muscle groups are engaged during the Weighted Plank?
166,How do I ensure my body remains straight while holding the Weighted Plank?
166,What type of equipment is needed for the Weighted Plank exercise?
166,Is the Weighted Plank primarily a strength or cardio exercise?
167,What is the main purpose of using the Step Mill exercise?
167,Which muscle groups are primarily targeted when using the Step Mill?
167,Can you explain how to perform the Step Mill exercise correctly?
167,Is the Step Mill considered a cardio workout?
167,What type of equipment is used for the Step Mill exercise?
168,What equipment do I need to perform the Standing Resistance Band Row?
168,Which muscle groups are primarily worked by this exercise?
168,Can you explain the correct form for pulling the handles during this exercise?
168,What body part does the Standing Resistance Band Row focus on?
168,Is this exercise considered a strength or cardio workout?
169,What is the primary focus of the Dumbbell Lunge exercise?
169,Which equipment is required to perform the Dumbbell Lunge?
169,How should the Dumbbell Lunge be executed step-by-step?
169,What muscle groups are targeted by the Dumbbell Lunge?
169,Is the Dumbbell Lunge classified as a push or pull exercise?
170,What is the primary muscle group targeted by the Reverse Curl exercise?
170,What type of grip should I use when performing the Reverse Curl?
170,"Do I need any equipment for the Reverse Curl, and if so, what kind?"
170,How should my feet be positioned while doing the Reverse Curl?
170,Is the Reverse Curl focused on pulling or pushing movements?
171,What is the primary muscle group targeted by the Banded Pull-Up exercise?
171,What type of equipment do I need to perform a Banded Pull-Up?
171,How do I properly set up for a Banded Pull-Up?
171,What body part does the Banded Pull-Up focus on strengthening?
171,What is the technique for executing a Banded Pull-Up correctly?
172,What equipment do I need to perform the Cable Face Pull exercise?
172,Which muscle groups are primarily activated during the Cable Face Pull?
172,Can you explain how to properly execute the Cable Face Pull?
172,What type of activity is the Cable Face Pull categorized under?
172,Which part of the body does the Cable Face Pull specifically target?
173,What equipment do I need to perform the Turkish Get-Up exercise?
173,Which muscle groups are activated when doing the Turkish Get-Up?
173,How should I position my body before starting the Turkish Get-Up?
173,What is the primary action involved in the Turkish Get-Up?
173,Is the Turkish Get-Up considered a strength or cardio exercise?
174,What equipment do I need for Weighted Russian Twists?
174,Which muscles are activated during the Weighted Russian Twists exercise?
174,Can you explain the proper form for performing Weighted Russian Twists?
174,Is Weighted Russian Twists effective for strengthening my core?
174,What is the correct position for my legs when doing Weighted Russian Twists?
175,What is the proper stance when performing the Cable Front Raise?
175,At what height should I raise the handle during the exercise?
175,Which muscles are primarily targeted by the Cable Front Raise?
175,What type of equipment is required for the Cable Front Raise?
175,Is the Cable Front Raise considered a push or pull exercise?
176,What is the proper starting position for a reverse crunch?
176,Which muscle groups are primarily targeted during the reverse crunch?
176,How should I perform the movement of lifting my hips during the reverse crunch?
176,What type of exercise is a reverse crunch categorized as?
176,Do I need any equipment to perform a reverse crunch?
177,What equipment do I need for the Cable Tricep Kickback exercise?
177,Which muscle group is primarily targeted by this exercise?
177,Can you describe the correct form for performing the Cable Tricep Kickback?
177,What type of activity is the Cable Tricep Kickback considered?
177,What is the starting position for the Cable Tricep Kickback?
178,What is the Copenhagen Plank and how is it performed?
178,Which muscle groups are engaged during the Copenhagen Plank?
178,Do I need any equipment to perform the Copenhagen Plank?
178,What position should my legs be in while doing the Copenhagen Plank?
178,Is the Copenhagen Plank a strength or cardio exercise?
179,What is the primary equipment used for the Smith Machine Incline Press?
179,Which muscle groups are primarily targeted during this exercise?
179,Can you describe the starting position for the Smith Machine Incline Press?
179,What type of exercise is the Smith Machine Incline Press categorized as?
179,What action should I perform with the bar during this exercise?
180,What equipment do I need for the Cable Lat Pulldown exercise?
180,Which muscle groups are primarily worked during the Cable Lat Pulldown?
180,Can you explain the setup process for the Cable Lat Pulldown?
180,What is the proper way to grip the bar for this exercise?
180,How should I perform the movement during the Cable Lat Pulldown?
181,What equipment do I need for the Cable Side Lunge exercise?
181,Which muscle groups does the Cable Side Lunge activate?
181,Can you explain the steps involved in performing a Cable Side Lunge?
181,Is the Cable Side Lunge primarily a strength exercise?
181,Which body part does the Cable Side Lunge focus on?
182,What is the primary muscle group targeted by the Dumbbell Bent-Over Row?
182,How should I position my feet when performing this exercise?
182,What type of equipment do I need for the Dumbbell Bent-Over Row?
182,Can you describe the proper body position during the exercise?
182,Is the Dumbbell Bent-Over Row classified as a push or pull exercise?
183,What is the primary focus of the Lateral Lunge exercise?
183,Which muscle groups are activated when performing Lateral Lunges?
183,How do I properly execute a Lateral Lunge?
183,Do I need any equipment to perform Lateral Lunges?
183,What type of activity classification does the Lateral Lunge fall under?
184,What type of exercise is the Seated Machine Row?
184,Which muscle groups are primarily activated during the Seated Machine Row?
184,What should I do with my feet while using the Seated Machine Row?
184,Can you describe the starting position for the Seated Machine Row?
184,Is the Seated Machine Row primarily an upper body or lower body exercise?
185,What position should I take on the decline bench for the Decline Russian Twist?
185,How should I move my torso during the Decline Russian Twist?
185,Which muscle groups are primarily targeted by the Decline Russian Twist exercise?
185,Is any equipment required for performing the Decline Russian Twist?
185,What is the main type of movement involved in the Decline Russian Twist?
186,What is the Deadlift High Pull exercise primarily designed to work on?
186,What type of equipment do I need to perform the Deadlift High Pull?
186,Can you explain the steps involved in executing the Deadlift High Pull properly?
186,What muscle groups are activated during the Deadlift High Pull?
186,Is the Deadlift High Pull considered a strength exercise or a cardio exercise?
187,What is the correct grip for the Reverse Grip Lat Pulldown exercise?
187,Which muscles are primarily targeted when performing the Reverse Grip Lat Pulldown?
187,Can you explain the proper sitting position for this exercise?
187,How should I return the bar after pulling it down to my chest?
187,What type of equipment do I need for the Reverse Grip Lat Pulldown?
188,What equipment do I need to perform the Cable Lateral Lunge?
188,Which body parts are primarily targeted by this exercise?
188,Can you explain the steps for executing a Cable Lateral Lunge?
188,Is this exercise suitable for building strength in my lower body?
188,What muscle groups will I activate when doing the Cable Lateral Lunge?
189,What is the starting position for a Pike Push-Up?
189,Which body parts are primarily worked during a Pike Push-Up?
189,What type of equipment is needed for performing a Pike Push-Up?
189,Can you explain how to correctly perform a Pike Push-Up?
189,Is the Pike Push-Up classified as a strength exercise?
190,What muscles are primarily worked by the One-Arm Dumbbell Snatch exercise?
190,Can you describe the starting position for the One-Arm Dumbbell Snatch?
190,Is the One-Arm Dumbbell Snatch considered a strength exercise?
190,What type of equipment do I need to perform the One-Arm Dumbbell Snatch?
190,How should I perform the motion of the One-Arm Dumbbell Snatch?
191,What equipment do I need to perform the Cable Front Squat effectively?
191,Which muscle groups are primarily activated during the Cable Front Squat exercise?
191,Can you describe the correct stance and positioning for this exercise?
191,What is the proper way to hold the rope handle while doing the Cable Front Squat?
191,"Is the Cable Front Squat suitable for beginners, and what should they keep in mind?"
192,What is the primary equipment used for the Tire Flip exercise?
192,Which muscles are primarily activated during the Tire Flip?
192,Can you describe the initial position for performing the Tire Flip?
192,What type of activity is the Tire Flip classified under?
192,Is the Tire Flip considered a full body workout?
193,What is the primary muscle group worked during the Smith Machine Calf Raise?
193,What equipment do I need to perform the Smith Machine Calf Raise?
193,Can you describe the starting position for this exercise?
193,What action do I take after raising my heels in the Smith Machine Calf Raise?
193,"Is this exercise categorized as a strength activity, and if so, what type?"
194,What is the starting position for the Pistol Squat to Box exercise?
194,Which muscles are primarily worked during the Pistol Squat to Box?
194,What equipment is needed to perform the Pistol Squat to Box?
194,Can the Pistol Squat to Box be performed without any equipment?
194,What is the main movement involved in the Pistol Squat to Box exercise?
195,What is the Standing Chest Fly and what type of activity is it?
195,Which equipment do I need to perform the Standing Chest Fly?
195,What part of the body does the Standing Chest Fly primarily target?
195,Can you explain how to properly perform the Standing Chest Fly?
195,What muscle groups are activated when doing the Standing Chest Fly?
196,What type of exercise is the Sled Drag classified as?
196,What equipment do I need for the Sled Drag exercise?
196,Which muscle groups are activated during the Sled Drag?
196,Can the Sled Drag be performed walking or running backwards?
196,What body part does the Sled Drag primarily target?
197,What equipment do I need for the Cable Hammer Curl?
197,Which muscles are primarily targeted by the Cable Hammer Curl?
197,Can you describe the proper stance for performing a Cable Hammer Curl?
197,What grip should I use while curling the handle in the Cable Hammer Curl?
197,Is the Cable Hammer Curl considered a strength exercise?
198,What is the proper starting position for the Cable Tricep Overhead Extension?
198,How do I ensure my arms are fully extended during the exercise?
198,Which muscle groups are primarily targeted by the Cable Tricep Overhead Extension?
198,What type of exercise is the Cable Tricep Overhead Extension classified as?
198,What equipment do I need to perform the Cable Tricep Overhead Extension?
199,What is the targeted muscle group when performing the Seated Cable Row?
199,What type of exercise is the Seated Cable Row considered?
199,How should I position my feet during the Seated Cable Row?
199,Can you explain the proper movement for the Seated Cable Row?
199,What type of equipment do I need for the Seated Cable Row?
200,What is the primary muscle group targeted by the Lying Dumbbell Tricep Extension exercise?
200,What equipment do I need to perform the Lying Dumbbell Tricep Extension?
200,Can you describe how to properly execute the Lying Dumbbell Tricep Extension?
200,Is the Lying Dumbbell Tricep Extension considered a push exercise?
200,Which part of the body does the Lying Dumbbell Tricep Extension mainly work on?
201,What is the proper way to perform a weighted pull-up?
201,Which muscle groups are primarily activated during a weighted pull-up?
201,Do I need any specific equipment for weighted pull-ups?
201,What part of the body does a weighted pull-up target?
201,Can I use dumbbells for the weighted pull-up exercise?
202,What is the primary muscle group targeted by the Incline Dumbbell Row exercise?
202,How should I position my body when performing the Incline Dumbbell Row?
202,What type of equipment do I need for the Incline Dumbbell Row?
202,Can you explain the movement I need to perform during the Incline Dumbbell Row?
202,Is the Incline Dumbbell Row classified as a push or pull exercise?
203,What is the primary muscle group targeted by the Machine Lat Pulldown exercise?
203,What type of activity is the Machine Lat Pulldown classified as?
203,What specific grip should I use when performing the Machine Lat Pulldown?
203,Can you describe the proper starting position for the Machine Lat Pulldown?
203,Which body part does the Machine Lat Pulldown primarily focus on?
204,What equipment do I need for the One-Arm Cable Row exercise?
204,Which muscle groups are primarily worked during the One-Arm Cable Row?
204,Can you explain the basic instructions for performing a One-Arm Cable Row?
204,Is the One-Arm Cable Row a strength exercise or a cardio exercise?
204,Which body part does the One-Arm Cable Row primarily target?
205,What equipment do I need to perform the Face Pull exercise?
205,Which muscle groups are targeted when doing Face Pulls?
205,Can you describe the correct technique for executing a Face Pull?
205,What part of the body does the Face Pull primarily work on?
205,Is the Face Pull considered a pull or push exercise?
206,What is the primary muscle group targeted by the Dumbbell Bench Press?
206,What equipment do I need to perform the Dumbbell Bench Press?
206,Can you describe the proper starting position for the Dumbbell Bench Press?
206,What type of exercise is the Dumbbell Bench Press classified as?
206,Which part of the body does the Dumbbell Bench Press mainly engage?
