id,question
81,What type of exercise is TRX Rows classified as?
81,Is TRX Rows primarily for my upper body strength?
82,What is the main equipment needed for Medicine Ball Russian Twists?
82,Which muscles are primarily targeted during this exercise?
82,Can you explain how to properly perform a Medicine Ball Russian Twist?
82,What body part does the Medicine Ball Russian Twist mainly focus on?
82,Is the Medicine Ball Russian Twist considered a strength exercise?
83,What is the Pendlay Row specifically used for in strength training?
83,Which equipment do I need to perform the Pendlay Row?
83,Can you describe the correct form for the Pendlay Row?
83,Which muscle groups are primarily engaged while doing the Pendlay Row?
83,What type of exercise is the Pendlay Row classified as: a push or a pull?
84,What muscles are targeted when performing the Side Plank with Leg Lift?
84,How should I position my body during the Side Plank with Leg Lift?
84,Is any special equipment required for the Side Plank with Leg Lift?
84,What type of exercise is the Side Plank with Leg Lift classified as?
84,What is the main focus of the Side Plank with Leg Lift in terms of body parts?
85,What is the primary muscle group targeted during the Hip Abduction exercise?
85,How do I perform the Hip Abduction on the machine?
85,Is the Hip Abduction considered a strength exercise?
85,What type of equipment do I need for the Hip Abduction?
85,Which body part does the Hip Abduction focus on?
86,What type of exercise is the Dumbbell Front Raise?
86,Which body part does the Dumbbell Front Raise target?
86,What equipment do I need to perform the Dumbbell Front Raise?
86,How should my hands be positioned when starting the Dumbbell Front Raise?
86,What is the main muscle group activated during the Dumbbell Front Raise?
87,What muscles do chin-ups primarily target?
87,How should I grip the bar when performing chin-ups?
87,Can you describe the movement involved in chin-ups?
87,What type of equipment do I need to perform chin-ups?
87,Is chin-ups an upper body or lower body exercise?
88,What is the Box Squat exercise primarily targeting in terms of muscle groups?
88,Can you describe the setup required for performing a Box Squat?
88,What is the main equipment needed to perform a Box Squat?
88,How do I correctly perform a Box Squat?
88,Is the Box Squat considered a push exercise or a pull exercise?
89,What type of physical activity does Battle Rope Waves fall under?
89,Which body parts are primarily worked during Battle Rope Waves?
89,What specific equipment do I need to perform Battle Rope Waves?
89,How do I properly execute the Battle Rope Waves exercise?
89,What muscle groups will I activate when doing Battle Rope Waves?
90,What are the primary muscles worked in the Zercher Squat?
90,How do I properly hold the barbell during a Zercher Squat?
90,What is the correct depth for the squat in this exercise?
90,Is the Zercher Squat considered a push or pull exercise?
90,What type of equipment do I need to perform the Zercher Squat?
91,What type of exercise is a Walking Lunge?
91,Which equipment is needed for Walking Lunges?
91,What main body part does Walking Lunges target?
91,Can you describe the correct technique for performing a Walking Lunge?
91,What muscle groups are engaged when doing Walking Lunges?
92,What type of exercise is the kettlebell snatch considered?
92,Which body parts are primarily worked when performing the kettlebell snatch?
92,Can you explain the main movement of the kettlebell snatch?
92,What type of equipment do I need to perform a kettlebell snatch?
92,Is the kettlebell snatch primarily a pushing or pulling exercise?
93,What is the primary muscle group targeted by the Single-Leg Glute Bridge exercise?
93,Can the Single-Leg Glute Bridge be performed without any equipment?
93,What position should my legs be in while doing the Single-Leg Glute Bridge?
93,What type of exercise is the Single-Leg Glute Bridge categorized as?
93,How do you execute the movement of lifting your hips during the Single-Leg Glute Bridge?
94,What are TRX Push-Ups and how are they performed?
94,Which muscle groups are activated during TRX Push-Ups?
94,What equipment do I need to perform TRX Push-Ups?
94,Is TRX Push-Ups suitable for strengthening the upper body?
94,What is the correct position for my body while doing TRX Push-Ups?
95,What is the primary muscle group activated by the Machine Leg Curl exercise?
95,How should I position myself on the leg curl machine?
95,Can you describe the movement involved in the Machine Leg Curl?
95,What is the primary body part targeted by this exercise?
95,Is the Machine Leg Curl considered a strength or cardio exercise?
96,What muscles are primarily worked during the Incline Bench Press?
96,Could you explain the setup for performing the Incline Bench Press?
96,What type of equipment do I need for the Incline Bench Press?
96,What body part does the Incline Bench Press primarily target?
96,What is the correct movement technique for the Incline Bench Press?
97,What equipment do I need for the Resistance Band Deadlift?
97,Which muscle groups are activated when performing the Resistance Band Deadlift?
97,Can you describe the proper stance for this exercise?
97,What is the main movement involved in the Resistance Band Deadlift?
97,How do I position my body before lifting the resistance band?
98,What equipment do I need for the Decline Bench Press exercise?
98,Which muscle groups are activated when performing the Decline Bench Press?
98,Can you describe the proper form for the Decline Bench Press?
98,What is the primary type of activity for the Decline Bench Press?
98,How should I position my body on the decline bench during this exercise?
99,What muscles are primarily worked during the Dumbbell Step-Up exercise?
99,What type of activity is the Dumbbell Step-Up classified as?
99,Do I need any specific equipment to perform the Dumbbell Step-Up?
99,Can you explain the proper form for executing a Dumbbell Step-Up?
99,Is the Dumbbell Step-Up considered a push or pull exercise?
100,What type of exercise is the Cable Lateral Raise?
100,Which equipment do I need to perform the Cable Lateral Raise?
100,What body part does the Cable Lateral Raise primarily target?
100,Can you explain how to properly perform the Cable Lateral Raise?
100,What muscle groups are activated during the Cable Lateral Raise?
101,What type of exercise is a Reverse Lunge?
101,What equipment do I need to perform a Reverse Lunge?
101,Which part of the body does the Reverse Lunge primarily target?
101,What are the main muscle groups activated during a Reverse Lunge?
101,Can you explain how to properly execute a Reverse Lunge?
102,What muscles are activated when performing Toe Touches?
102,How should I position my legs during the Toe Touches exercise?
102,Is any equipment needed for Toe Touches?
102,Can you describe the starting position for Toe Touches?
102,What type of exercise is Toe Touches classified as?
103,What muscles are primarily targeted during the Machine Leg Extension exercise?
103,How should I position myself on the leg extension machine?
103,What is the correct motion for the Machine Leg Extension?
103,Is the Machine Leg Extension considered a push or pull type exercise?
103,Which body part does the Machine Leg Extension focus on?
104,What is the primary muscle group worked by the Dumbbell Pullover?
104,Can you explain how to perform the Dumbbell Pullover correctly?
104,What type of equipment do I need for the Dumbbell Pullover exercise?
104,Is the Dumbbell Pullover considered a strength exercise or a cardio workout?
104,Which body part does the Dumbbell Pullover primarily target?
105,What specific muscle group does the Barbell Shrug target?
105,Can you describe the starting position for performing a Barbell Shrug?
105,How should I position my feet while doing the Barbell Shrug?
105,What is the correct movement for the shoulders during the Barbell Shrug?
105,"Is it necessary to use a barbell for this exercise, or can I use other equipment?"
106,What muscles are worked during the T-Bar Row exercise?
106,What type of equipment do I need for the T-Bar Row?
106,What is the correct stance when performing the T-Bar Row?
106,How do I execute the rowing motion in the T-Bar Row?
106,Is the T-Bar Row considered a strength or cardio exercise?
107,What muscles are primarily worked by the Bulgarian Deadlift?
107,What equipment do I need to perform the Bulgarian Deadlift?
107,Can you describe the stance for the Bulgarian Deadlift?
107,Is the Bulgarian Deadlift a push or pull exercise?
107,Which body part does the Bulgarian Deadlift target?
108,What is the primary focus of the Pistol Squat exercise?
108,Can I perform the Pistol Squat without any equipment?
108,Which muscle groups are worked during the Pistol Squat?
108,What are the steps involved in performing a Pistol Squat correctly?
108,Is the Pistol Squat primarily a push or pull exercise?
109,What is the primary muscle group targeted by the Seated Leg Curl exercise?
109,Can you describe the main instruction for performing the Seated Leg Curl?
109,What type of equipment is needed to perform the Seated Leg Curl?
109,Is the Seated Leg Curl considered a strength activity or a cardio activity?
109,Which body part does the Seated Leg Curl primarily work on?
110,What is the main purpose of the Russian Kettlebell Swing exercise?
110,Which equipment do I need to perform the Russian Kettlebell Swing?
110,What body parts are primarily targeted during this exercise?
110,Can you explain the correct technique for executing a kettlebell swing?
110,Is the Russian Kettlebell Swing more focused on cardio or strength training?
111,What equipment do I need to perform the Incline Dumbbell Curl exercise?
111,Which muscle groups are targeted by the Incline Dumbbell Curl?
111,What is the proper position to start the Incline Dumbbell Curl?
111,Can you describe the movement involved in the Incline Dumbbell Curl?
111,Is the Incline Dumbbell Curl considered a pull type exercise?
112,What is the proper position for performing decline sit-ups?
112,Which muscle groups are primarily targeted during decline sit-ups?
112,What type of equipment do I need for decline sit-ups?
112,How should I execute the movement during decline sit-ups?
112,Is this exercise considered a strength activity?
113,What is the starting position for Side Plank Dips?
113,Which muscle groups are primarily activated during this exercise?
113,How do I properly perform the movement of lowering and lifting my hips in a Side Plank Dip?
113,What type of equipment do I need to perform Side Plank Dips?
113,Is the Side Plank Dips exercise mainly for core strength?
114,What is the primary equipment needed for the Single Arm Kettlebell Swing?
114,Which muscle groups are engaged during the exercise?
114,How should I position the kettlebell while performing the swing?
114,What is the correct movement to initiate the Single Arm Kettlebell Swing?
114,Is this exercise primarily a strength-based activity?
115,What muscles are targeted by jumping squats?
115,How do you properly execute a jumping squat?
115,Is any equipment needed for jumping squats?
115,What type of workout does jumping squats fall under?
115,Which body part is primarily worked during jumping squats?
116,What is the primary purpose of the Cable Chest Fly exercise?
116,Which part of the body does the Cable Chest Fly mainly target?
116,What type of equipment is required to perform the Cable Chest Fly?
116,Can you describe the correct starting position for the Cable Chest Fly?
116,What movement should be performed after bringing the handles together in front?
117,What is the correct way to position the dumbbell for a tricep extension?
117,Which body part is primarily targeted during the dumbbell tricep extension?
117,How do I perform the movement correctly for maximum effectiveness?
117,What type of exercise is the dumbbell tricep extension classified as?
117,What type of equipment do I need for this exercise?
118,What equipment do I need for the Leg Curl exercise?
118,Which part of the body is primarily worked by the Leg Curl?
118,Can you explain the proper technique for performing a Leg Curl?
118,Is the Leg Curl considered a strength training exercise?
118,What muscle group is targeted when doing the Leg Curl?
119,What is the starting position for the One-Arm Push-Up?
119,Which muscle groups are activated during the One-Arm Push-Up?
119,What body part does the One-Arm Push-Up primarily target?
119,What should I do after lowering my body in the One-Arm Push-Up?
119,Is any equipment required to perform the One-Arm Push-Up?
120,What is the proper way to perform the Machine Shoulder Press?
120,Which muscle groups are primarily worked during the Machine Shoulder Press?
120,What type of equipment is needed for the Machine Shoulder Press?
120,Is the Machine Shoulder Press considered a push exercise?
120,What part of the body does the Machine Shoulder Press target?
121,What stance should I take when performing the sumo squat?
121,How low should I lower my hips during the exercise?
121,What muscles are primarily activated when doing sumo squats?
121,Is any equipment required for this exercise?
121,What type of exercise classification does sumo squat fall under?
122,What is the primary equipment needed for the Resistance Band Squat?
122,Which muscle groups are targeted during the Resistance Band Squat?
122,Can you describe how to position my feet during this exercise?
122,What body part does the Resistance Band Squat primarily focus on?
122,Is the Resistance Band Squat considered a strength training exercise?
123,What is the correct starting position for a One-Legged Squat?
123,Which muscles are primarily worked during the One-Legged Squat?
123,How do I perform the One-Legged Squat correctly?
123,Do I need any equipment to do a One-Legged Squat?
123,Is the One-Legged Squat considered a strength exercise?
124,What setup is required for the Landmine Row exercise?
124,Which muscle groups are primarily targeted when performing the Landmine Row?
124,Can you explain the correct technique for executing a Landmine Row?
124,Is there a specific type of barbell needed for the Landmine Row?
124,What body part does the Landmine Row mainly focus on?
125,What is the starting position for the Superman Exercise?
125,Which muscle groups are primarily targeted by this exercise?
125,How do I perform the Superman Exercise correctly?
125,What type of equipment do I need for the Superman Exercise?
125,Is the Superman Exercise focused on strength training or cardio?
126,What is the primary muscle group targeted during Dumbbell Flyes?
126,What type of exercise is Dumbbell Flyes classified as?
126,What equipment do I need to perform Dumbbell Flyes?
126,Can you describe the starting position for Dumbbell Flyes?
126,Is Dumbbell Flyes considered a push exercise?
127,What is the main purpose of the Reverse Fly exercise?
127,Which muscle groups are primarily worked during the Reverse Fly?
127,Can I perform the Reverse Fly without using dumbbells?
127,How should I position my body while doing the Reverse Fly?
127,Is the Reverse Fly considered a pull exercise?
128,What equipment do I need for Cable Kickbacks?
128,Which body parts are targeted during Cable Kickbacks?
128,Can you describe how to perform Cable Kickbacks correctly?
128,What muscle groups are activated when doing Cable Kickbacks?
128,Is Cable Kickbacks considered a strength exercise?
129,How do I properly hold the kettlebell for the push press exercise?
129,Which muscles are targeted when performing the kettlebell push press?
129,Can you explain the steps for executing the kettlebell push press?
129,What body parts are primarily involved in the kettlebell push press?
129,Is it necessary to engage my legs during the kettlebell push press?
130,What is the Dead Bug exercise and how is it performed?
130,Which muscles are targeted when performing the Dead Bug exercise?
130,Do I need any equipment to do the Dead Bug exercise?
130,What is the primary body part worked during the Dead Bug?
130,What should I focus on to maintain proper form during the Dead Bug?
131,What muscles are primarily targeted by the Smith Machine Squat?
131,Can you describe the proper form for performing a Smith Machine Squat?
131,What type of exercise is the Smith Machine Squat classified as?
131,"Is equipment necessary for the Smith Machine Squat, and if so, what type?"
131,What body part does the Smith Machine Squat mainly work?
132,What is the correct position on the hyperextension bench for the Reverse Hyperextension exercise?
132,Which muscle groups are primarily targeted by the Reverse Hyperextension?
132,How do I properly perform the movement of lifting my legs in this exercise?
132,Is the Reverse Hyperextension exercise suitable for strengthening my lower back?
132,What type of equipment do I need to perform the Reverse Hyperextension?
133,What muscles are primarily activated during the Landmine Twist exercise?
133,What is the main equipment required to perform the Landmine Twist?
133,How should I position my core while doing the Landmine Twist?
133,What is the correct way to hold the barbell during this exercise?
133,In which direction do I rotate the barbell while performing the Landmine Twist?
134,What body parts are primarily targeted by the Machine Row exercise?
134,Can you explain the proper positioning for the Machine Row?
134,What muscle groups are activated during the Machine Row?
134,Is the Machine Row considered a strength training exercise?
134,What is the correct movement pattern for performing the Machine Row?
135,What equipment do I need to perform the Seated Calf Raise exercise?
135,Which body part does the Seated Calf Raise primarily target?
135,Can you describe the proper form for the Seated Calf Raise?
135,What is the main action performed during the Seated Calf Raise?
135,Is the Seated Calf Raise considered a strength exercise?
136,What muscles are primarily activated when performing the Kettlebell Windmill?
136,Can you explain the correct form to hold the kettlebell during this exercise?
136,Which body part is mainly targeted by the Kettlebell Windmill?
136,Is this exercise considered a strength or cardio workout?
136,What equipment do I need to perform the Kettlebell Windmill?
137,What is the Incline Barbell Bench Press and what equipment do I need?
137,Which muscle groups are primarily targeted during the Incline Barbell Bench Press?
137,Can you describe the proper technique for performing the Incline Barbell Bench Press?
137,What is the position of my body while doing the Incline Barbell Bench Press?
137,Is the Incline Barbell Bench Press considered a push or pull exercise?
138,What is the correct way to hold the kettlebell during the Goblet Squat?
138,Which body parts are primarily targeted by the Kettlebell Goblet Squat?
138,Can you explain the proper form for performing a Goblet Squat?
138,What type of exercise classification does the Kettlebell Goblet Squat fall under?
138,Is this exercise primarily focused on pushing or pulling movements?
139,What is a dumbbell thruster and how do I perform it?
139,Which muscle groups are primarily worked during dumbbell thrusters?
139,What equipment do I need for dumbbell thrusters?
139,Is the dumbbell thruster effective for full body workouts?
139,What is the proper form to maintain while doing dumbbell thrusters?
140,What is the primary muscle group targeted by the Lying Leg Curl exercise?
140,What type of equipment do I need to perform the Lying Leg Curl?
140,Can you describe the starting position for the Lying Leg Curl?
140,Is the Lying Leg Curl classified as a pull exercise or a push exercise?
140,What body part does the Lying Leg Curl primarily focus on?
141,What is the correct stance for performing a Dumbbell Hammer Curl?
141,Which muscle groups are primarily worked during the Dumbbell Hammer Curl?
141,How should I grip the dumbbells while doing this exercise?
141,What is the movement involved in a Dumbbell Hammer Curl?
141,Is this exercise meant for the upper body or lower body?
142,What equipment do I need to perform the Landmine Squat Press?
142,Which muscle groups are targeted when I do the Landmine Squat Press?
142,Can you describe the proper technique for executing the Landmine Squat Press?
142,Is the Landmine Squat Press suitable for full body workouts?
142,What type of activity is the Landmine Squat Press classified as?
143,What is the main muscle group targeted by the Zottman Curl?
143,What type of grip do you use when curling the weights in the Zottman Curl?
143,What equipment do I need to perform the Zottman Curl?
143,How should my feet be positioned when doing the Zottman Curl?
143,What is the correct technique for lowering the weights in the Zottman Curl?
144,What is the correct way to perform a Cable Crunch?
144,Which muscle group does the Cable Crunch primarily target?
144,What type of equipment do I need to do the Cable Crunch?
144,What position should I start in when doing Cable Crunches?
144,Is it important to keep my back straight during the Cable Crunch?
145,What is the primary muscle group targeted by the Stability Ball Pike exercise?
145,How should I position my body when starting the Stability Ball Pike?
145,What type of equipment is required to perform the Stability Ball Pike?
145,Can you describe the movement involved in the Stability Ball Pike exercise?
145,Is the Stability Ball Pike considered a strength or flexibility exercise?
146,What is the proper starting position for the Standing Calf Raise exercise?
146,How do I correctly perform a Standing Calf Raise?
146,Which muscle groups are targeted during the Standing Calf Raise?
146,What type of equipment do I need for the Standing Calf Raise?
146,Is the Standing Calf Raise considered a strength exercise or a cardio exercise?
147,What equipment do I need to perform the Cable Kickback exercise?
147,Which part of my body does the Cable Kickback primarily target?
147,Can you describe the proper stance and movement for the Cable Kickback?
147,What type of exercise is the Cable Kickback classified as?
147,Is the Cable Kickback more focused on strength training or cardio?
148,What is the starting position for Spider Push-Ups?
148,Which muscle groups are engaged during Spider Push-Ups?
148,How do I perform the knee movement while doing Spider Push-Ups?
148,Do I need any equipment to do Spider Push-Ups?
148,Is there a specific body part that Spider Push-Ups target?
149,What equipment do I need for the Resistance Band Chest Press exercise?
149,Which muscle groups are activated when performing the Resistance Band Chest Press?
149,Can you provide the instructions for how to properly perform the Resistance Band Chest Press?
149,What type of activity is the Resistance Band Chest Press classified as?
149,Is the Resistance Band Chest Press primarily a push or pull exercise?
150,What equipment do I need for the One-Arm Dumbbell Row exercise?
150,Which muscle groups are activated during the One-Arm Dumbbell Row?
150,Can you describe the starting position for performing the One-Arm Dumbbell Row?
150,Is the One-Arm Dumbbell Row considered a strength or cardio exercise?
150,What body part does the One-Arm Dumbbell Row primarily target?
151,What is the primary position for performing the Incline Chest Press exercise?
151,Which equipment do I need to perform the Incline Chest Press?
151,What muscle groups are worked during the Incline Chest Press?
151,Can you describe the motion involved in the Incline Chest Press?
151,Is the Incline Chest Press more focused on pushing or pulling movements?
152,What is the primary muscle group targeted by the Machine Preacher Curl exercise?
152,Can you describe the correct sitting position on the preacher curl machine?
152,How should I perform the curling motion during the exercise?
152,What type of equipment do I need for the Machine Preacher Curl?
152,Is the Machine Preacher Curl classified as a strength training or cardio exercise?
153,What is the correct way to perform Hanging Knee Raises?
153,Which muscles are primarily targeted during Hanging Knee Raises?
153,Do I need any equipment to do Hanging Knee Raises?
153,How should I position my legs during the exercise?
153,Is there a specific body part that Hanging Knee Raises focus on?
154,What position should I be in when performing the Decline Dumbbell Press?
154,Which muscles are primarily targeted by the Decline Dumbbell Press?
154,What equipment do I need to perform the Decline Dumbbell Press?
154,Can you describe the movement involved in the Decline Dumbbell Press?
154,Is the Decline Dumbbell Press suitable for upper body strength training?
155,What is the starting position for the Glute Kickback exercise?
155,Which muscle groups are primarily activated during the Glute Kickback?
155,How should I perform the kick during the Glute Kickback?
155,Is any equipment needed for the Glute Kickback?
155,What type of activity is the Glute Kickback categorized as?
156,What muscle groups does the Machine Chest Press target?
156,How do I properly position myself on the chest press machine?
156,What type of exercise is the Machine Chest Press categorized as?
156,Can you explain the motion involved in the Machine Chest Press?
156,What body part is primarily worked during the Machine Chest Press?
157,What body part does the Single-Leg Squat primarily target?
157,How do you perform the Single-Leg Squat correctly?
157,Which muscle groups are activated during this exercise?
157,Is any equipment needed for the Single-Leg Squat?
157,What type of strength activity is the Single-Leg Squat categorized as?
158,What is the starting position for the Push-Up to Row exercise?
158,Which equipment do I need to perform the Push-Up to Row?
158,What muscles are primarily worked during the Push-Up to Row?
158,Can you explain the steps involved in executing the Push-Up to Row?
158,Is the Push-Up to Row considered a push or pull exercise?
