id,question
0,What is the starting position for push-ups?
0,Which muscle groups are targeted during push-ups?
0,Do I need any equipment to perform push-ups?
0,How do I properly lower my body during a push-up?
0,What type of exercise are push-ups classified as?
1,What body position should I maintain during squats?
1,Which muscle groups are activated when performing squats?
1,Do I need any equipment to perform squats?
1,How should my feet be positioned while doing squats?
1,What is the proper motion for lowering my body during squats?
2,What is the correct starting position for the Plank exercise?
2,Which muscle groups are primarily activated during the Plank?
2,How should my body be aligned while holding a Plank?
2,What type of exercise is Plank classified as?
2,Do I need any equipment to perform the Plank?
3,What is the proper stance for performing a deadlift?
3,Which part of the body does the deadlift primarily work?
3,How should I grasp the barbell before lifting it?
3,What muscles will be activated during a deadlift?
3,Can you describe the movement involved in lifting the barbell?
4,What muscles are targeted by bicep curls?
4,What is the correct starting position for bicep curls?
4,Do I need any equipment to perform bicep curls?
4,How should my elbows be positioned during the exercise?
4,What type of exercise are bicep curls classified as?
5,What equipment do I need for the Kettlebell Swing?
5,Which muscle groups are primarily activated during the Kettlebell Swing?
5,Can you provide me with the correct stance for the Kettlebell Swing?
5,What type of activity does the Kettlebell Swing fall under?
5,What is the main movement technique for swinging the kettlebell up?
6,What equipment do I need to perform the Shoulder Press exercise?
6,Which muscle groups are targeted when doing the Shoulder Press?
6,Can you explain the proper form for the Shoulder Press?
6,Is the Shoulder Press considered a push or pull exercise?
6,What body part does the Shoulder Press primarily work on?
7,What is the primary muscle group targeted by the Lat Pulldown exercise?
7,How should I grip the bar when performing the Lat Pulldown?
7,What is the correct starting position for the Lat Pulldown?
7,Can the Lat Pulldown help strengthen my biceps?
7,What type of exercise equipment is needed for the Lat Pulldown?
8,What equipment do I need for the Hamstring Stretch?
8,How should I position my body during the Hamstring Stretch?
8,Which muscle group does the Hamstring Stretch target?
8,What part of the body is primarily involved in the Hamstring Stretch?
8,Is the Hamstring Stretch considered a mobility exercise?
9,What are jumping jacks primarily used for in fitness routines?
9,Which body parts does performing jumping jacks activate?
9,Do I need any equipment to perform jumping jacks?
9,Can jumping jacks serve as both a cardio and warm-up exercise?
9,What is the correct form for executing a jumping jack?
10,What is the correct starting position for the bench press exercise?
10,Which muscle groups are primarily targeted during the bench press?
10,Can you explain how to perform the bench press correctly?
10,What type of equipment is needed to do a bench press?
10,Is the bench press an upper body exercise or a lower body exercise?
11,What type of exercise are lunges classified as?
11,Which body parts are primarily targeted during lunges?
11,What equipment do I need to perform lunges?
11,Can you explain the proper form for a lunge?
11,What muscle groups are activated when doing lunges?
12,What grip should I use when performing pull-ups?
12,Which muscles are worked during pull-ups?
12,Can I do pull-ups without any equipment?
12,What is the proper technique for doing pull-ups?
12,What part of the body do pull-ups primarily target?
13,What is the starting position for Mountain Climbers?
13,Which muscle groups are activated during Mountain Climbers?
13,Is any equipment needed to perform Mountain Climbers?
13,How should I drive my knees when doing this exercise?
13,Is Mountain Climbers primarily a cardio or strength exercise?
14,What is the primary body part targeted by the Leg Raises exercise?
14,What muscle groups are activated when performing Leg Raises?
14,How should I position my body when doing Leg Raises?
14,What type of activity are Leg Raises categorized under?
14,"Is any equipment needed for Leg Raises, or can it be done with just bodyweight?"
15,What equipment do I need to perform Tricep Dips?
15,Which muscle groups are activated during Tricep Dips?
15,Can you explain the proper technique for executing Tricep Dips?
15,Is Tricep Dips considered a strength exercise?
15,What part of the body is primarily targeted by Tricep Dips?
16,What is the name of the exercise focused on core strength?
16,What muscle groups does the Russian Twists exercise target?
16,What position should I be in while performing Russian Twists?
16,Do I need any equipment to do Russian Twists?
16,How do I execute the twisting motion in Russian Twists?
17,What basic position should I start in when performing burpees?
17,Which muscle groups are primarily targeted during burpees?
17,Can you explain the step-by-step process to correctly perform a burpee?
17,Is any equipment necessary for doing burpees?
17,What type of exercise are burpees classified as?
18,What muscles are primarily worked during Dumbbell Rows?
18,Can you describe the proper form for performing Dumbbell Rows?
18,What type of equipment do I need for Dumbbell Rows?
18,Is Dumbbell Rows an upper body or lower body exercise?
18,What is the main action involved in Dumbbell Rows?
19,What is the primary equipment needed for Goblet Squats?
19,Which muscle groups are activated during Goblet Squats?
19,How should I position the kettlebell while performing Goblet Squats?
19,What type of exercise are Goblet Squats classified as?
19,Which part of the body does Goblet Squats primarily target?
20,What is the starting position for the Glute Bridge exercise?
20,Which muscle groups does the Glute Bridge target?
20,What type of activity is the Glute Bridge classified as?
20,Do I need any equipment to perform the Glute Bridge?
20,How do I properly execute the lift during the Glute Bridge?
21,What equipment do I need to perform the Overhead Tricep Extension?
21,Which muscle group is primarily targeted during this exercise?
21,Can you explain the proper technique for the Overhead Tricep Extension?
21,Is the Overhead Tricep Extension considered a strength exercise?
21,What part of the body does the Overhead Tricep Extension focus on?
22,What is the correct starting position for the Side Plank exercise?
22,Which muscle groups are primarily activated during the Side Plank?
22,Do I need any equipment to perform the Side Plank?
22,How should I position my body when holding the Side Plank?
22,What type of exercise is the Side Plank classified as?
23,What is the primary muscle group targeted by Cable Flyes?
23,Can you describe the stance I should take while performing Cable Flyes?
23,Should my elbows be straight or slightly bent during Cable Flyes?
23,What type of equipment do I need to perform Cable Flyes?
23,Is Cable Flyes considered a push or pull exercise?
24,What type of activity is Step-Ups classified as?
24,What muscle groups are activated during Step-Ups?
24,Do I need any equipment to perform Step-Ups?
24,Can you provide instructions for properly performing Step-Ups?
24,Which body part primarily benefits from Step-Ups?
25,What equipment do I need to perform Barbell Rows?
25,Which muscles are primarily worked during Barbell Rows?
25,Can you describe the stance I should use for this exercise?
25,What is the correct form for rowing the barbell towards my torso?
25,Is Barbell Rows focused on the upper body or lower body?
26,What equipment do I need for the Chest Press exercise?
26,Which muscle groups are primarily activated during the Chest Press?
26,Can you explain how to perform the Chest Press correctly?
26,What part of the body does the Chest Press target?
26,Is the Chest Press considered a push-type exercise?
27,What is the primary muscle group worked during box jumps?
27,Do I need any equipment to perform box jumps?
27,How should I land when I jump onto the box?
27,Can box jumps be considered both a cardio and strength exercise?
27,What body part does the box jump primarily target?
28,What are the main muscle groups worked during Hanging Leg Raises?
28,What equipment do I need to perform Hanging Leg Raises?
28,Can you guide me on how to execute Hanging Leg Raises correctly?
28,What type of exercise is Hanging Leg Raises classified as?
28,Is there a specific position I should hold my legs in while doing Hanging Leg Raises?
29,What is the primary focus of the Farmer's Walk exercise?
29,What type of equipment is required for the Farmer's Walk?
29,Which muscle groups are engaged during the Farmer's Walk?
29,Can the Farmer's Walk be classified as strength or cardio?
29,What is the correct form to maintain while performing the Farmer's Walk?
30,What is the primary muscle group targeted by calf raises?
30,What are the instructions for performing calf raises?
30,Is any equipment needed for calf raises?
30,How does the calf raise exercise affect the lower body?
30,What type of exercise is calf raises considered to be?
31,What type of exercise is Battle Ropes classified as?
31,Which equipment do I need for the Battle Ropes exercise?
31,What specific body parts will get activated while doing Battle Ropes?
31,Can you explain how to properly perform the Battle Ropes exercise?
31,What muscle groups will I be targeting when using Battle Ropes?
32,What is the primary body part targeted by medicine ball slams?
32,What equipment do I need to perform medicine ball slams?
32,Can you describe how to properly execute a medicine ball slam?
32,What muscle groups are activated while doing medicine ball slams?
32,"Is this exercise classified as cardio, strength, or both?"
33,What is the main purpose of performing the Dumbbell Deadlift exercise?
33,Which muscle groups are primarily targeted when doing the Dumbbell Deadlift?
33,Can you describe the correct stance for the Dumbbell Deadlift?
33,What is the proper form for lowering and lifting the weights during a Dumbbell Deadlift?
33,"Is the Dumbbell Deadlift considered a pull exercise, and why?"
34,What equipment do I need to perform the Push Press exercise?
34,Which body parts are targeted during the Push Press?
34,Can you explain the proper form for executing the Push Press?
34,How can I utilize my legs effectively during the Push Press?
34,What muscle groups are primarily worked when doing the Push Press?
35,What muscles are primarily worked during a treadmill run?
35,What type of activity is a treadmill run categorized as?
35,Can you explain how to adjust the treadmill for this exercise?
35,What body part does the treadmill run primarily target?
35,Is the treadmill run considered a pushing or pulling exercise?
36,What is the primary exercise for targeting the pectorals and triceps?
36,Which equipment is needed for performing the incline dumbbell press?
36,What position should I be in to execute the incline dumbbell press correctly?
36,How do I perform the incline dumbbell press correctly?
36,Which muscle groups are engaged during the incline dumbbell press?
37,What equipment do I need for Renegade Rows?
37,Which muscle groups are primarily targeted by this exercise?
37,How do I properly begin the Renegade Rows?
37,What body parts are engaged during the Renegade Rows?
37,Is the Renegade Rows exercise considered a strength training activity?
38,What is the primary muscle group targeted during the Leg Press exercise?
38,Can you describe the proper stance for my feet on the Leg Press machine?
38,What type of equipment do I need to perform the Leg Press exercise?
38,Is the Leg Press considered a push type of exercise?
38,Which body part does the Leg Press primarily work on?
39,What equipment do I need for the Cable Tricep Pushdown exercise?
39,How should I position myself while performing the Cable Tricep Pushdown?
39,Which muscle groups does the Cable Tricep Pushdown primarily target?
39,What is the movement direction during the Cable Tricep Pushdown?
39,What are the instructions for executing the Cable Tricep Pushdown correctly?
40,What muscles are primarily worked during the Single-Leg Deadlift?
40,What is the proper stance to take when performing a Single-Leg Deadlift?
40,What type of equipment do I need to perform the Single-Leg Deadlift?
40,How do I hold the dumbbell while executing the Single-Leg Deadlift?
40,What body part does the Single-Leg Deadlift primarily target?
41,What is the primary muscle group worked during inverted rows?
41,"Do I need any equipment to perform inverted rows, or can I use just my body weight?"
41,What is the proper form for executing inverted rows effectively?
41,"Is this exercise suitable for beginners, or should I have prior experience with strength training?"
41,How do inverted rows compare to other upper body exercises?
42,What position should I stand in when performing the Pallof Press?
42,At what height should the cable handle be set for this exercise?
42,Which muscle groups are primarily targeted by the Pallof Press?
42,How do I perform the Pallof Press to effectively engage my core?
42,Should I be resisting any movement while pushing the handle out?
43,What muscles are primarily activated during the Kettlebell Deadlift?
43,Can you describe the positioning of my feet while performing the Kettlebell Deadlift?
43,What equipment do I need to perform the Kettlebell Deadlift?
43,How do I properly lift the kettlebell from the ground during this exercise?
43,Which type of exercise is the Kettlebell Deadlift classified as?
44,What are Hanging Knee Tucks primarily working on in terms of muscle groups?
44,What equipment do I need to perform Hanging Knee Tucks?
44,Can you explain the steps for executing Hanging Knee Tucks properly?
44,What type of exercise are Hanging Knee Tucks classified as?
44,Which body part is primarily targeted by Hanging Knee Tucks?
45,What muscles are primarily targeted when performing Resistance Band Pull Aparts?
45,What equipment do I need to do Resistance Band Pull Aparts?
45,Can you explain the correct position of my arms during the exercise?
45,Is this exercise suitable for strengthening my upper body?
45,How do I properly execute the pulling motion with the resistance band?
46,What is the proper stance for Bulgarian Split Squats?
46,How do I ensure my front thigh is parallel to the floor during this exercise?
46,Which muscle groups are primarily targeted with Bulgarian Split Squats?
46,"Is bodyweight sufficient for Bulgarian Split Squats, or do I need additional equipment?"
46,Can you explain the movement pattern during the Bulgarian Split Squats?
47,What is the correct starting position for the Seated Shoulder Press exercise?
47,Which muscles are primarily worked during the Seated Shoulder Press?
47,What type of equipment do I need to perform the Seated Shoulder Press?
47,Can you tell me the steps to properly execute the Seated Shoulder Press?
47,Is the Seated Shoulder Press classified as a push or pull exercise?
48,What equipment do I need to perform Incline Push-Ups?
48,Which parts of my body do Incline Push-Ups target?
48,Can you describe the proper form for Incline Push-Ups?
48,What type of activity are Incline Push-Ups classified as?
48,How do I correctly position my hands for Incline Push-Ups?
49,What is the proper setup for performing hip thrusts with a barbell?
49,Which muscle groups are primarily targeted during hip thrusts?
49,Can you explain the correct technique for lifting my hips in this exercise?
49,What type of equipment do I need to perform hip thrusts effectively?
49,Is this exercise considered a push movement or a pull movement?
50,What is the proper stance for performing a Barbell Curl?
50,How do I grip the barbell for this exercise?
50,Which muscles are targeted during the Barbell Curl?
50,What is the movement process of a Barbell Curl?
50,What type of exercise is the Barbell Curl classified as?
51,What is the primary equipment needed for the Cable Row exercise?
51,Which body part does the Cable Row primarily target?
51,Can you explain the correct sitting position for the Cable Row?
51,What muscles are engaged during the Cable Row?
51,How do I properly perform the pulling motion in the Cable Row?
52,What is the starting position for Plank Shoulder Taps?
52,Which muscle groups are primarily targeted during this exercise?
52,How do I maintain stability while tapping my shoulder?
52,Is any equipment required for Plank Shoulder Taps?
52,What type of exercise is the Plank Shoulder Taps classified as?
53,What equipment do I need for the Dumbbell Lateral Raise?
53,What specific body part does this exercise target?
53,Can you describe the proper form for performing a Dumbbell Lateral Raise?
53,What type of exercise is the Dumbbell Lateral Raise categorized as?
53,Which muscle groups are activated during this exercise?
54,What is the Wall Sit exercise primarily targeting in terms of muscle groups?
54,How should I position my feet when performing a Wall Sit?
54,What angle should my knees be at during the Wall Sit?
54,Is any equipment necessary for the Wall Sit exercise?
54,What type of activity is the Wall Sit classified as?
55,What is the Spider Plank exercise primarily targeting?
55,What muscle groups are activated during the Spider Plank?
55,Can I perform the Spider Plank without any equipment?
55,What is the starting position for the Spider Plank?
55,How do I execute the movement in the Spider Plank?
56,What stance should I have while performing the Sumo Deadlift?
56,Which muscle groups are activated during the Sumo Deadlift?
56,How should I position my hands when grasping the barbell?
56,What type of equipment do I need for the Sumo Deadlift?
56,What is the proper technique for lifting the barbell in this exercise?
57,What position should I start in for the Single Arm Dumbbell Row?
57,Which muscle groups are primarily worked during this exercise?
57,How should I hold the dumbbell while performing the exercise?
57,What is the main focus of the Single Arm Dumbbell Row in terms of movement type?
57,Do I need any special equipment besides a dumbbell for this exercise?
58,What muscles are primarily activated during the Kettlebell Clean and Press?
58,Can you explain the proper form for performing a Kettlebell Clean and Press?
58,Is the Kettlebell Clean and Press suitable for a full body workout?
58,What type of movement is the Kettlebell Clean and Press classified as?
58,How do I incorporate the Kettlebell Clean and Press into my strength training routine?
59,What is the primary type of exercise associated with jump rope?
59,Which body parts are primarily engaged when performing jump rope?
59,What equipment do I need to perform jump rope exercises?
59,Can jump rope be classified as a push exercise?
59,How do I correctly perform jump rope to maintain a steady rhythm?
60,What is the proper form for performing a side lunge?
60,Which muscles are targeted when doing a side lunge?
60,Do I need any equipment to do a side lunge?
60,Can you explain the movement involved in a side lunge?
60,Is the side lunge primarily a strength exercise for the lower body?
61,What is the Machine Chest Fly exercise primarily designed to target?
61,Can I perform the Machine Chest Fly using free weights instead of a machine?
61,What steps should I follow to execute the Machine Chest Fly correctly?
61,What muscle groups do I activate when performing the Machine Chest Fly?
61,Is the Machine Chest Fly considered a push or pull exercise?
62,What muscles are primarily targeted during the Hack Squat exercise?
62,Can you describe the proper stance to use while performing a Hack Squat on the machine?
62,How should I position my feet when using the Hack Squat machine?
62,What is the correct movement pattern for executing a Hack Squat?
62,Is the Hack Squat more beneficial for strengthening the lower body compared to other exercises?
63,What is the correct position for my feet during decline push-ups?
63,Which muscle groups are primarily worked by decline push-ups?
63,How do I perform a decline push-up correctly?
63,What type of equipment do I need for decline push-ups?
63,Is the decline push-up suitable for improving upper body strength?
64,What equipment do I need for the Band Face Pull exercise?
64,Which muscle groups are activated when performing the Band Face Pull?
64,Can you explain the proper way to perform the Band Face Pull?
64,What part of the body does the Band Face Pull primarily target?
64,Is the Band Face Pull considered a strength or cardio exercise?
65,What is the primary muscle group targeted by the Ab Wheel Rollout?
65,Can you explain the initial position for performing the Ab Wheel Rollout?
65,What kind of equipment do I need for the Ab Wheel Rollout exercise?
65,How do I maintain stability while rolling the wheel forward?
65,Is the Ab Wheel Rollout considered a push type of exercise?
66,What position should I be in to perform Side Leg Raises effectively?
66,Which leg do I need to lift when doing this exercise?
66,What muscles are engaged during Side Leg Raises?
66,Are any equipment required to perform Side Leg Raises?
66,What type of exercise is Side Leg Raises classified as?
67,What equipment do I need for the Romanian Deadlift?
67,Which muscle groups are targeted during this exercise?
67,Can you describe the proper form for performing a Romanian Deadlift?
67,Is the Romanian Deadlift primarily a pulling or pushing exercise?
67,Which part of my body will feel the most strain while doing this exercise?
68,What is the main focus of the Arnold Press exercise?
68,Which muscle groups does the Arnold Press work on?
68,What equipment do I need to perform the Arnold Press?
68,Can you explain the proper technique for the Arnold Press?
68,Is the Arnold Press suitable for beginners?
69,What is the primary muscle group targeted by the Landmine Press exercise?
69,Which type of equipment do I need to perform the Landmine Press?
69,What is the proper technique for pressing the barbell during the Landmine Press?
69,Is the Landmine Press considered a push exercise?
69,What body part does the Landmine Press focus on?
70,What are tuck jumps primarily targeting in terms of muscle activation?
70,Can you explain the correct technique for performing tuck jumps?
70,What equipment do I need to do tuck jumps?
70,Are tuck jumps considered a strength or cardio exercise?
70,How should I land after completing a tuck jump?
71,What is the primary muscle group targeted by the Windshield Wipers exercise?
71,Can you describe the initial position I should start in for doing Windshield Wipers?
71,Is any special equipment needed to perform Windshield Wipers?
71,What type of exercise is Windshield Wipers classified as?
71,How should I move my legs while performing the Windshield Wipers?
72,What equipment do I need to perform Dumbbell Shrugs?
72,Which muscle group is primarily targeted by Dumbbell Shrugs?
72,Can you explain the proper stance for doing Dumbbell Shrugs?
72,What is the correct motion for Dumbbell Shrugs?
72,Is Dumbbell Shrugs classified as a strength exercise?
73,What muscles are primarily activated during the Sled Push exercise?
73,What type of equipment do I need to perform the Sled Push?
73,Can I integrate the Sled Push into both cardio and strength workouts?
73,What is the correct form I should maintain while pushing the sled?
73,Is the Sled Push suitable for full body workouts?
74,What equipment do I need to perform a Cable Bicep Curl?
74,Which muscle groups are primarily targeted by the Cable Bicep Curl?
74,Can you describe the correct stance to adopt when executing this exercise?
74,What is the starting position for a Cable Bicep Curl?
74,How do I execute the movement for the Cable Bicep Curl correctly?
75,What is the primary muscle group worked during the Dumbbell Kickback?
75,Can I perform the Dumbbell Kickback without any equipment?
75,How should my body be positioned while doing the Dumbbell Kickback?
75,What type of exercise is the Dumbbell Kickback classified as?
75,How do I properly execute the movement for the Dumbbell Kickback?
76,What is the primary muscle group targeted by Flutter Kicks?
76,Do I need any equipment to perform Flutter Kicks?
76,How do I properly execute Flutter Kicks?
76,In what position should I start when doing Flutter Kicks?
76,What is the main focus of Flutter Kicks?
77,What type of activity is High Knees classified as?
77,Which muscle groups are primarily activated during High Knees?
77,Do I need any equipment to perform High Knees?
77,Can you describe how to properly perform High Knees?
77,What part of the body does High Knees work out?
78,What type of physical activity do Sledgehammer Slams fall under?
78,What equipment do I need to perform Sledgehammer Slams?
78,Which muscle groups are primarily activated during Sledgehammer Slams?
78,Can you explain the proper technique for executing Sledgehammer Slams?
78,"Is this exercise primarily for cardio, strength, or both?"
79,What equipment do I need to perform Lateral Step-Ups?
79,Which muscle groups are activated during Lateral Step-Ups?
79,Can you explain the steps involved in executing Lateral Step-Ups?
79,Is Lateral Step-Ups considered a strength exercise?
79,Which body part primarily gets worked with Lateral Step-Ups?
80,What is the primary muscle group targeted by the Cable Chest Press?
80,What type of exercise is the Cable Chest Press classified as?
80,What equipment do I need to perform the Cable Chest Press?
80,Can you describe the starting position for the Cable Chest Press?
80,Which body part does the Cable Chest Press primarily focus on?
81,What muscles does the TRX Rows exercise target specifically?
81,Can you explain the correct posture I should maintain while performing TRX Rows?
81,How do I properly grip the handles during TRX Rows?
